number,value,datetime_start,datetime_complete,duration,params_batch_size,params_dropout,params_dropout2d,params_fc_mid,params_lr,params_optimizer_type,params_scheduler_type,params_weight_decay,state
0,48.89,2025-10-16 09:45:43.654125,2025-10-16 09:53:42.682916,0 days 00:07:59.028791,256,0.34973279224012654,0.16370173320348286,256,0.0005611516415334506,adam,cosine,0.0007969454818643932,COMPLETE
1,47.07,2025-10-16 09:53:42.688928,2025-10-16 10:01:27.829199,0 days 00:07:45.140271,128,0.15990213464750794,0.2542703315240835,256,0.0002310201887845295,adamw,cosine,2.3270677083837777e-05,COMPLETE
2,43.73,2025-10-16 10:01:27.831709,2025-10-16 10:09:15.499489,0 days 00:07:47.667780,128,0.13661147045343366,0.2485530730333811,192,0.0015304852121831463,adam,none,1.2385137298860926e-05,COMPLETE
3,41.06,2025-10-16 10:09:15.504009,2025-10-16 10:16:48.986785,0 days 00:07:33.482776,512,0.2793699936433256,0.37656227050693514,192,0.00011715937392307068,adamw,none,0.000658628931758311,COMPLETE
4,44.39,2025-10-16 10:16:48.989751,2025-10-16 10:24:40.148087,0 days 00:07:51.158336,128,0.12236519310393126,0.3960660809801553,256,0.00015030900645056822,adamw,cosine,2.4658447214487366e-05,COMPLETE
5,36.46,2025-10-16 10:24:40.151113,2025-10-16 10:25:48.833655,0 days 00:01:08.682542,128,0.19926940745579477,0.1190675050858071,192,0.0035033984911586884,adamw,none,2.497073714505272e-05,PRUNED
6,36.01,2025-10-16 10:25:48.835021,2025-10-16 10:27:36.078099,0 days 00:01:47.243078,512,0.25681984881459824,0.2282623055075649,192,0.0004187594718900631,adam,cosine,4.4706085467784903e-05,PRUNED
7,36.6,2025-10-16 10:27:36.079961,2025-10-16 10:29:25.117320,0 days 00:01:49.037359,128,0.1869254358741304,0.14836638617620135,128,0.0001124186209579306,adamw,none,1.6435497475111308e-05,PRUNED
8,30.27,2025-10-16 10:29:25.119279,2025-10-16 10:31:05.120789,0 days 00:01:40.001510,128,0.16838054876258252,0.2281323365878769,128,0.007234279845665418,adamw,cosine,0.00041327654594663655,PRUNED
9,28.95,2025-10-16 10:31:05.122180,2025-10-16 10:55:28.342732,0 days 00:24:23.220552,512,0.20908888071378823,0.3915346248162882,256,0.00432543242796456,adamw,cosine,0.0005265761277157427,PRUNED
10,34.3,2025-10-16 10:55:28.345364,2025-10-16 11:00:54.201886,0 days 00:05:25.856522,256,0.3588014686089798,0.25677286245319225,256,0.0006748501049997427,adam,cosine,0.0005371101450451586,PRUNED
11,42.55,2025-10-16 11:00:54.203595,2025-10-16 11:03:55.739408,0 days 00:03:01.535813,256,0.30867833844586734,0.1120676891183977,256,0.0001613314079163818,adamw,cosine,0.0007812092554352483,PRUNED
12,41.57,2025-10-16 11:03:55.740594,2025-10-16 11:06:31.610024,0 days 00:02:35.869430,128,0.1732969237311384,0.1395100995544526,256,0.00014277462457092457,adam,cosine,1.3316011005352846e-05,PRUNED
13,47.17,2025-10-16 11:06:31.611448,2025-10-16 11:14:51.553783,0 days 00:08:19.942335,128,0.19283680776536022,0.189190165272635,256,0.0008120761701225854,adamw,cosine,4.899767962940042e-05,COMPLETE
14,48.99,2025-10-16 11:14:51.558155,2025-10-16 11:22:39.636513,0 days 00:07:48.078358,256,0.33333794333085626,0.12267918801224734,192,0.0010436570509116535,adam,cosine,0.0004038749088599552,COMPLETE
15,21.81,2025-10-16 11:22:39.638321,2025-10-16 11:23:40.444034,0 days 00:01:00.805713,256,0.32502408253709153,0.12461105554263217,256,0.008613020970535151,adam,cosine,0.0006063079949943634,PRUNED
16,34.83,2025-10-16 11:23:40.445744,2025-10-16 11:25:21.016484,0 days 00:01:40.570740,256,0.38200331833375606,0.182514914133322,192,0.0010062392992715604,adam,none,0.00021985575917824737,PRUNED
17,39.78,2025-10-16 11:25:21.017801,2025-10-16 11:27:34.619295,0 days 00:02:13.601494,512,0.330264950018198,0.10811435399208066,192,0.0002456352481554616,adam,cosine,0.00030166994517316805,PRUNED
18,37.11,2025-10-16 11:27:34.620637,2025-10-16 11:29:23.372631,0 days 00:01:48.751994,128,0.2553009602127056,0.10679620529934675,192,0.00199947280962935,adam,cosine,0.00015812232877863083,PRUNED
19,47.96,2025-10-16 11:29:23.374168,2025-10-16 11:38:12.486441,0 days 00:08:49.112273,256,0.38089203488488,0.11358994388810066,128,0.0011544946394379295,adam,cosine,9.956711263431459e-05,COMPLETE
20,34.32,2025-10-16 11:38:12.489336,2025-10-16 11:39:13.012496,0 days 00:01:00.523160,256,0.17166019476615257,0.23521654415770402,192,0.00032344037766309175,adam,cosine,0.000758732217203396,PRUNED
21,45.28,2025-10-16 11:39:13.013794,2025-10-16 11:43:00.044435,0 days 00:03:47.030641,256,0.3217324673327683,0.12032475639498096,128,0.0017871321290370617,adamw,cosine,0.0002302238157530061,PRUNED
22,45.47,2025-10-16 11:43:00.045539,2025-10-16 11:47:14.721559,0 days 00:04:14.676020,256,0.2904449183823383,0.12639727587082022,128,0.0008518598410023735,adam,cosine,5.276290893916079e-05,PRUNED
23,30.84,2025-10-16 11:47:14.722586,2025-10-16 11:48:56.669355,0 days 00:01:41.946769,256,0.3951589068044051,0.14666744074705743,128,0.0018898427638762824,adam,cosine,0.00032607187635891685,PRUNED
24,48.72,2025-10-16 11:48:56.671043,2025-10-16 11:57:19.382704,0 days 00:08:22.711661,128,0.32818162578983673,0.13475030319897313,256,0.0003667648216174769,adam,cosine,0.0004079227966998775,COMPLETE
25,45.12,2025-10-16 11:57:19.387271,2025-10-16 12:00:18.275000,0 days 00:02:58.887729,128,0.31461899397215504,0.12284793905478121,256,0.0003479412010896537,adam,cosine,0.0002593959534307869,PRUNED
26,35.4,2025-10-16 12:00:18.277451,2025-10-16 12:07:16.735028,0 days 00:06:58.457577,256,0.3709191558807748,0.1323306459973945,192,0.001002495988310184,adam,cosine,0.0006428681570165929,PRUNED
27,31.76,2025-10-16 12:07:16.736866,2025-10-16 12:09:04.776425,0 days 00:01:48.039559,512,0.31966295350799256,0.13883365103646841,256,0.0021308013200860526,adam,none,0.0007256199648719972,PRUNED
28,43.69,2025-10-16 12:09:04.779849,2025-10-16 12:16:45.047505,0 days 00:07:40.267656,256,0.24500939615365883,0.13832253467981484,256,0.0008649058041337146,adam,cosine,0.0005279714509593785,PRUNED
29,34.75,2025-10-16 12:16:45.049133,2025-10-16 12:43:33.252566,0 days 00:26:48.203433,128,0.308089671947303,0.17452017545121556,192,0.0020144015831281576,adamw,cosine,0.0005849010146786437,PRUNED
30,35.48,2025-10-16 12:43:33.254380,2025-10-16 12:45:14.415649,0 days 00:01:41.161269,256,0.3425284607045435,0.12623780751053643,256,0.00016164269023395268,adam,cosine,0.0008851764294927185,PRUNED
31,43.55,2025-10-16 12:45:14.416926,2025-10-16 12:58:56.074596,0 days 00:13:41.657670,512,0.3919007295579346,0.1269581393954601,128,0.0009515970295864555,adam,cosine,4.8662796918302543e-05,PRUNED
32,32.99,2025-10-16 12:58:56.076276,2025-10-16 13:00:41.401109,0 days 00:01:45.324833,128,0.37872011943451045,0.23308183439794242,256,0.00011613431384931653,adam,none,0.00038412640878007076,PRUNED
33,34.74,2025-10-16 13:00:41.402553,2025-10-16 13:02:26.121674,0 days 00:01:44.719121,128,0.31414247149957725,0.1635467151795593,128,0.000166499000569298,adam,cosine,0.000953192366499505,PRUNED
34,46.05,2025-10-16 13:02:26.123624,2025-10-16 13:07:42.265909,0 days 00:05:16.142285,128,0.30544357035564457,0.10646433299971851,128,0.0004887995587025603,adamw,cosine,5.6177513586911315e-05,PRUNED
35,45.65,2025-10-16 13:07:42.271458,2025-10-16 13:12:43.079795,0 days 00:05:00.808337,128,0.3448449747662329,0.12385016646975061,128,0.0007374076746374234,adam,none,6.731087506727628e-05,PRUNED
36,45.35,2025-10-16 13:12:43.081954,2025-10-16 13:17:17.283438,0 days 00:04:34.201484,256,0.36113680681329136,0.1612608991459532,256,0.0006263329652407977,adamw,none,0.00030105750880034656,PRUNED
37,45.61,2025-10-16 13:17:17.284982,2025-10-16 13:21:26.050727,0 days 00:04:08.765745,256,0.3545059665046215,0.11338260350548825,256,0.0008755928797791702,adam,none,3.530688127986355e-05,PRUNED
38,45.36,2025-10-16 13:21:26.052160,2025-10-16 13:25:25.301743,0 days 00:03:59.249583,256,0.3872826446334802,0.10735187786510643,192,0.0005403074701055652,adamw,cosine,6.901230458789022e-05,PRUNED
39,45.59,2025-10-16 13:25:25.302836,2025-10-16 13:29:11.228259,0 days 00:03:45.925423,256,0.3841323384594938,0.10239606462963977,128,0.0007689779826180468,adam,none,0.0002015522251908488,PRUNED
40,33.43,2025-10-16 13:29:11.229374,2025-10-16 13:31:28.823734,0 days 00:02:17.594360,512,0.33133623281536945,0.230741884062945,256,0.00047232269608147925,adam,cosine,0.0007793123787879967,PRUNED
41,45.31,2025-10-16 13:31:28.826163,2025-10-16 13:36:34.389745,0 days 00:05:05.563582,128,0.16744759737864387,0.16846482547620556,256,0.000280123585171253,adamw,cosine,6.711330084073017e-05,PRUNED
42,35.58,2025-10-16 13:36:34.391255,2025-10-16 13:38:20.060507,0 days 00:01:45.669252,128,0.21388319705200493,0.18843880373308308,256,0.0017861410018591775,adamw,cosine,2.940338790865051e-05,PRUNED
43,36.37,2025-10-16 13:38:20.062347,2025-10-16 13:40:07.087689,0 days 00:01:47.025342,256,0.37983683422801046,0.11954461380480318,128,0.0008546958002106702,adam,cosine,8.064081657199111e-05,PRUNED
44,44.7,2025-10-16 13:40:07.089576,2025-10-16 13:43:36.044979,0 days 00:03:28.955403,512,0.21771119278784845,0.1643617466891634,256,0.002022318444926346,adamw,cosine,0.00018000658041355386,PRUNED
45,46.67,2025-10-16 13:43:36.046877,2025-10-16 13:50:09.997833,0 days 00:06:33.950956,128,0.3407910615431965,0.1615798527128804,256,0.0005674912776972575,adamw,cosine,0.0005256453100189517,PRUNED
46,44.75,2025-10-16 13:50:09.998895,2025-10-16 13:54:07.061287,0 days 00:03:57.062392,256,0.27715925251528123,0.11259196333758983,192,0.00042380438406585763,adam,none,0.0005349844670589739,PRUNED
47,45.66,2025-10-16 13:54:07.063927,2025-10-16 13:58:08.735676,0 days 00:04:01.671749,256,0.1631316685011906,0.21312006261954033,256,0.0006298362928150282,adamw,cosine,3.0137784350771547e-05,PRUNED
48,39.01,2025-10-16 13:58:08.736904,2025-10-16 14:21:40.186053,0 days 00:23:31.449149,128,0.21595711849008997,0.28847649734425374,256,0.0007561436848260854,adamw,none,4.535689892952804e-05,PRUNED
49,32.26,2025-10-16 14:21:40.188522,2025-10-16 14:23:31.830885,0 days 00:01:51.642363,256,0.31906532324288184,0.13713689295560086,192,0.0035001521979223468,adam,cosine,0.00012367025590865667,PRUNED
50,32.49,2025-10-16 14:23:31.832757,2025-10-16 14:25:23.887110,0 days 00:01:52.054353,256,0.3655253985802983,0.1313353990701406,256,0.0010350361907658996,adam,cosine,0.0009039393518990205,PRUNED
51,39.37,2025-10-16 14:25:23.889092,2025-10-16 14:27:34.159153,0 days 00:02:10.270061,128,0.12778756829046348,0.30204216915163556,256,0.0008030102564486201,adamw,cosine,4.3796434586702026e-05,PRUNED
52,45.26,2025-10-16 14:27:34.161433,2025-10-16 14:31:15.046859,0 days 00:03:40.885426,128,0.17984650169004204,0.253839272598294,192,0.00030255029222131985,adamw,cosine,2.7902488565304788e-05,PRUNED
53,35.01,2025-10-16 14:31:15.048235,2025-10-16 14:32:59.306673,0 days 00:01:44.258438,128,0.26495686442294597,0.3032735372426569,256,0.00027113559632568776,adamw,cosine,1.8759129084092402e-05,PRUNED
54,34.81,2025-10-16 14:32:59.308694,2025-10-16 14:34:43.493051,0 days 00:01:44.184357,512,0.22656210062996268,0.22083086303913335,128,0.0006489109398736013,adamw,cosine,2.857179633691098e-05,PRUNED
55,32.38,2025-10-16 14:34:43.494773,2025-10-16 14:36:28.151475,0 days 00:01:44.656702,128,0.33660657989890397,0.17076511040109066,256,0.0017190435999302142,adam,cosine,0.00043716287502735705,PRUNED
56,30.56,2025-10-16 14:36:28.153190,2025-10-16 14:38:11.272726,0 days 00:01:43.119536,128,0.38766378549268987,0.10269409795331898,192,0.00278796607933742,adam,cosine,0.0003371173026485561,PRUNED
57,45.81,2025-10-16 14:38:11.275215,2025-10-16 14:42:03.568675,0 days 00:03:52.293460,128,0.12715762705166322,0.2097375054963077,128,0.00033370187088119945,adamw,cosine,2.785896679308655e-05,PRUNED
58,42.67,2025-10-16 14:42:03.569760,2025-10-16 14:47:53.095771,0 days 00:05:49.526011,128,0.1647010444909906,0.23716503418105733,256,0.00023776430271271956,adam,cosine,6.944082115296775e-05,PRUNED
59,36.29,2025-10-16 14:47:53.097392,2025-10-16 14:54:44.592495,0 days 00:06:51.495103,128,0.1898520607596101,0.2074039679834755,256,0.00016764790228855254,adamw,cosine,1.3813622295245729e-05,PRUNED
60,29.79,2025-10-16 14:54:44.595412,2025-10-16 14:56:37.999099,0 days 00:01:53.403687,256,0.10789479916292924,0.308643658535952,256,0.0001075713035209275,adamw,cosine,2.745845181283529e-05,PRUNED
61,30.66,2025-10-16 14:56:38.003222,2025-10-16 15:13:38.148296,0 days 00:17:00.145074,128,0.1343680235537367,0.3761376207806852,256,0.00013010933265745705,adamw,none,2.514175402502436e-05,PRUNED
62,33.04,2025-10-16 15:13:38.151766,2025-10-16 15:15:48.190446,0 days 00:02:10.038680,128,0.13003017504034536,0.3648131732659134,256,0.00023367607194787405,adamw,cosine,3.508822141956247e-05,PRUNED
63,31.89,2025-10-16 15:15:48.193021,2025-10-16 15:17:30.810311,0 days 00:01:42.617290,512,0.19781149240587037,0.26631786992263795,256,0.0002299677671088551,adamw,cosine,2.1512957226035883e-05,PRUNED
64,28.23,2025-10-16 15:17:30.812490,2025-10-16 15:19:12.536919,0 days 00:01:41.724429,128,0.1462033798455743,0.3622480577572317,128,0.0001016800508672812,adamw,cosine,8.258797549247193e-05,PRUNED
65,29.74,2025-10-16 15:19:12.538420,2025-10-16 15:20:56.227903,0 days 00:01:43.689483,128,0.12120929972560356,0.3916939685035405,192,0.00013584086323185695,adamw,cosine,3.5092459916133764e-05,PRUNED
66,43.9,2025-10-16 15:20:56.230067,2025-10-16 15:23:52.952256,0 days 00:02:56.722189,128,0.33442265660295684,0.14933319355644417,192,0.00028148628494055055,adam,cosine,0.00013829018995060386,PRUNED
67,48.53,2025-10-16 15:23:52.954007,2025-10-16 16:14:10.572413,0 days 00:50:17.618406,256,0.3148680600978568,0.13170479469109458,192,0.0005890193979341738,adam,cosine,0.00031742623977831753,COMPLETE
68,35.61,2025-10-16 16:14:10.575983,2025-10-16 16:15:13.863185,0 days 00:01:03.287202,256,0.3042504094253221,0.19626476046464836,192,0.00022873999097131932,adam,cosine,0.00034414818630951064,PRUNED
69,45.44,2025-10-16 16:15:13.865634,2025-10-16 16:19:09.324758,0 days 00:03:55.459124,256,0.3552514538444401,0.11181433875032999,192,0.0008315373119423814,adam,cosine,0.00010521642399038434,PRUNED
70,39.82,2025-10-16 16:19:09.325909,2025-10-16 16:21:17.282216,0 days 00:02:07.956307,256,0.297257052876999,0.11971591968647859,128,0.0002749080233490938,adam,cosine,0.0004298951054307108,PRUNED
71,30.06,2025-10-16 16:21:17.283587,2025-10-16 16:23:00.663172,0 days 00:01:43.379585,256,0.31552572419406055,0.3866964025191736,192,0.00025773732283476447,adamw,cosine,0.0001754878527010581,PRUNED
72,38.83,2025-10-16 16:23:00.665112,2025-10-16 16:25:05.794539,0 days 00:02:05.129427,256,0.39589597407045496,0.20681288892714225,256,0.00046256439412158535,adam,cosine,0.00013644617502097756,PRUNED
73,35.6,2025-10-16 16:25:05.796995,2025-10-16 16:26:49.304618,0 days 00:01:43.507623,256,0.2639713510587749,0.16248423288776145,192,0.0008116024433861544,adam,cosine,0.0003486888024779524,PRUNED
74,30.39,2025-10-16 16:26:49.307255,2025-10-16 16:28:33.010342,0 days 00:01:43.703087,128,0.2144663665210415,0.2617647242800456,256,0.00323243319308794,adam,cosine,6.804807664371366e-05,PRUNED
75,39.47,2025-10-16 16:28:33.013805,2025-10-16 16:30:40.069239,0 days 00:02:07.055434,128,0.3628225600295335,0.1439834539993258,256,0.00015692165620799102,adam,cosine,0.0003493688234463103,PRUNED
76,44.07,2025-10-16 16:30:40.071608,2025-10-16 16:33:39.538663,0 days 00:02:59.467055,128,0.11187663080120064,0.11888073731483742,256,0.0010536208950996315,adamw,cosine,3.663605519887931e-05,PRUNED
77,34.98,2025-10-16 16:33:39.540396,2025-10-16 16:35:21.225716,0 days 00:01:41.685320,128,0.1934419134409748,0.19569721654767783,128,0.001830003600564995,adamw,cosine,8.677391322677253e-05,PRUNED
78,30.5,2025-10-16 16:35:21.228139,2025-10-16 16:37:03.280229,0 days 00:01:42.052090,128,0.13720652770433905,0.39875753272617753,256,0.0001865940363327627,adamw,cosine,1.242557246658837e-05,PRUNED
79,31.6,2025-10-16 16:37:03.282288,2025-10-16 16:38:46.012757,0 days 00:01:42.730469,512,0.3141953899361155,0.1326833425539395,192,0.00362173878778983,adam,cosine,0.00039823678669720933,PRUNED
80,29.26,2025-10-16 16:38:46.015062,2025-10-16 16:40:31.112534,0 days 00:01:45.097472,128,0.12662076319850962,0.39414276000201137,256,0.00013162611310603333,adam,cosine,1.7413626035513645e-05,PRUNED
81,35.53,2025-10-16 16:40:31.115310,2025-10-16 16:42:14.102361,0 days 00:01:42.987051,256,0.1169220072315888,0.2735536019752768,192,0.0011778005696222572,adam,none,1.3660752284789033e-05,PRUNED
82,33.93,2025-10-16 16:42:14.104711,2025-10-16 16:44:04.046700,0 days 00:01:49.941989,128,0.1369649470842137,0.18374629429105907,192,0.00279126179940986,adam,none,1.3714034286125504e-05,PRUNED
83,35.98,2025-10-16 16:44:04.049139,2025-10-16 16:45:49.013358,0 days 00:01:44.964219,128,0.17745522034806493,0.21188375794299216,128,0.0009414244351493724,adam,none,2.4809333525185655e-05,PRUNED
84,43.51,2025-10-16 16:45:49.015020,2025-10-16 16:48:48.310052,0 days 00:02:59.295032,512,0.13481300977445843,0.11717753758719135,192,0.0004870268948433259,adam,none,1.978111979761386e-05,PRUNED
85,28.86,2025-10-16 16:48:48.311756,2025-10-16 16:50:31.256679,0 days 00:01:42.944923,128,0.1356157795215999,0.2887034146593419,192,0.005481502072846222,adam,none,1.6372818262441886e-05,PRUNED
86,36.01,2025-10-16 16:50:31.258110,2025-10-16 16:52:18.621791,0 days 00:01:47.363681,128,0.14387917572588146,0.2627522218243303,192,0.0007111252138659683,adam,none,1.6581165659248454e-05,PRUNED
87,31.41,2025-10-16 16:52:18.623609,2025-10-16 16:54:01.703888,0 days 00:01:43.080279,128,0.3761784752705514,0.2276517409235042,128,0.001355045437550552,adam,cosine,9.284623172930396e-05,PRUNED
88,29.65,2025-10-16 16:54:01.705905,2025-10-16 16:55:46.203004,0 days 00:01:44.497099,256,0.3414834603841701,0.10279789775560202,128,0.00462350244249927,adam,cosine,0.00014047802254544875,PRUNED
89,42.31,2025-10-16 16:55:46.204791,2025-10-16 16:58:20.979710,0 days 00:02:34.774919,512,0.16926594997566397,0.20199965233091466,256,0.0005915696478138666,adamw,none,6.675135348834489e-05,PRUNED
90,34.67,2025-10-16 16:58:20.981322,2025-10-16 17:00:03.786552,0 days 00:01:42.805230,128,0.256965873036451,0.2661935932510907,192,0.001490588564752534,adamw,none,1.1891186909826395e-05,PRUNED
91,29.76,2025-10-16 17:00:03.788510,2025-10-16 17:01:45.900795,0 days 00:01:42.112285,512,0.28461385278237594,0.30500915200918177,192,0.0002062975161786055,adamw,none,0.0003991120120888499,PRUNED
92,26.81,2025-10-16 17:01:45.902597,2025-10-16 17:03:28.668536,0 days 00:01:42.765939,128,0.32286334161587726,0.37577636563630656,192,0.00010109137059028202,adam,none,0.0008873130068379832,PRUNED
93,28.45,2025-10-16 17:03:28.670427,2025-10-16 17:05:11.281384,0 days 00:01:42.610957,512,0.28450222230459427,0.38994191091180025,192,0.00026195433309792674,adamw,none,0.0008401910289293409,PRUNED
94,30.57,2025-10-16 17:05:11.283269,2025-10-16 17:06:55.622476,0 days 00:01:44.339207,128,0.28781360100771586,0.3210832640209215,192,0.00010495792813283992,adamw,none,0.0003375780936419584,PRUNED
95,36.29,2025-10-16 17:06:55.624557,2025-10-16 17:08:38.496480,0 days 00:01:42.871923,128,0.11514833475738874,0.17302956532152244,192,0.0011898369016416636,adam,cosine,2.5734877636719847e-05,PRUNED
96,24.34,2025-10-16 17:08:38.498624,2025-10-16 17:10:20.755655,0 days 00:01:42.257031,512,0.37132769858267456,0.3959562089849372,256,0.0001498898801868922,adam,none,0.0006985060221239065,PRUNED
97,39.0,2025-10-16 17:10:20.757846,2025-10-16 17:12:22.981589,0 days 00:02:02.223743,256,0.3347995161957533,0.10959103774261171,192,0.0001994503465009254,adamw,cosine,0.00031290628822981334,PRUNED
98,23.19,2025-10-16 17:12:22.983454,2025-10-16 17:14:05.194119,0 days 00:01:42.210665,512,0.2586372118965762,0.37046781232727677,192,0.00011513510189560208,adam,none,0.0008268617160016855,PRUNED
99,20.63,2025-10-16 17:14:05.195833,2025-10-16 17:15:47.318880,0 days 00:01:42.123047,512,0.19536249394570931,0.39973041806980775,128,0.00010350962993464839,adamw,none,0.0008325064135392865,PRUNED
100,34.55,2025-10-16 17:15:47.320358,2025-10-16 17:18:13.199031,0 days 00:02:25.878673,128,0.18778761746743458,0.2884724337726971,256,0.00113212457569224,adam,none,1.4181623257443438e-05,PRUNED
101,36.07,2025-10-16 17:18:13.201588,2025-10-16 17:21:22.737153,0 days 00:03:09.535565,256,0.28871110381364945,0.25409449721177924,256,0.001283891385748327,adamw,cosine,0.0007055792258110138,PRUNED
102,46.34,2025-10-16 17:21:22.738393,2025-10-16 17:26:48.699712,0 days 00:05:25.961319,128,0.39000968747470827,0.18013825084554164,256,0.0002952909320460498,adamw,cosine,0.0005832932480391821,PRUNED
103,44.03,2025-10-16 17:26:48.702380,2025-10-16 17:30:00.647621,0 days 00:03:11.945241,128,0.29362569578839404,0.13152052942368078,256,0.00019662122897282945,adamw,cosine,0.00016796139685832566,PRUNED
104,44.32,2025-10-16 17:30:00.649165,2025-10-16 17:33:06.624917,0 days 00:03:05.975752,128,0.3399619973536086,0.18220286131914976,256,0.00026497013375968183,adamw,none,0.00043333560547876974,PRUNED
105,34.62,2025-10-16 17:33:06.626891,2025-10-16 17:34:53.920995,0 days 00:01:47.294104,256,0.335101571401073,0.21384530314265218,256,0.0002552657806227858,adam,cosine,0.0009815780890610824,PRUNED
106,36.27,2025-10-16 17:34:53.923187,2025-10-16 17:36:41.350912,0 days 00:01:47.427725,256,0.2902003217572771,0.21111866526625844,256,0.0005322110695159096,adam,none,0.00039444517709761256,PRUNED
107,33.28,2025-10-16 17:36:41.353101,2025-10-16 17:38:25.772372,0 days 00:01:44.419271,512,0.26484560839241,0.3049748870771171,192,0.0019889046447030827,adam,none,3.605572320298208e-05,PRUNED
108,26.6,2025-10-16 17:38:25.774768,2025-10-16 17:40:11.326189,0 days 00:01:45.551421,512,0.2540356081126162,0.39376161737364657,192,0.00018988083960348674,adamw,cosine,0.00020309791401747936,PRUNED
